{
  "schema_id": "agent_evolution.quality_scope.v1",
  "repository": "clawgym-sregym-provider",
  "version": 1,
  "active_files": [
    "clawgym_overlay/__init__.py",
    "clawgym_overlay/agent_composition.py",
    "clawgym_overlay/composition.py",
    "clawgym_overlay/compatibility_registry.py",
    "clawgym_overlay/deployment_lock.py",
    "clawgym_overlay/environment_materializer.py",
    "clawgym_overlay/environment_qualification.py",
    "clawgym_overlay/first_party_dependency.py",
    "clawgym_overlay/live_checks.py",
    "clawgym_overlay/live_composition.py",
    "clawgym_overlay/locked_runtime.py",
    "clawgym_overlay/materialize_lock.py",
    "clawgym_overlay/materializer.py",
    "clawgym_overlay/platform_observation.py",
    "clawgym_overlay/provenance.py",
    "clawgym_overlay/providers/__init__.py",
    "clawgym_overlay/providers/reference_agent.py",
    "clawgym_overlay/providers/sregym.py",
    "clawgym_overlay/qualification_runner.py",
    "clawgym_overlay/r1c_protocol.py",
    "clawgym_overlay/r1f_protocol.py",
    "clawgym_overlay/reference_driver_r1f.py",
    "clawgym_overlay/materialized_profile.py",
    "clawgym_overlay/namespace_lifecycle.py",
    "clawgym_overlay/projection.py",
    "clawgym_overlay/recipe_qualification_runner.py",
    "clawgym_overlay/reference_runner.py",
    "clawgym_overlay/release.py",
    "clawgym_overlay/validation_profiles.py",
    "clawgym_overlay/worker.py",
    "clawgym_overlay/worker_admission.py",
    "clawgym_overlay/worker_profile.py",
    "clawgym_overlay/worker_runtime.py",
    "clawgym_overlay/runtime_image_backend.py",
    "clawgym_overlay/tool_grant.py"
  ],
  "frozen_compatibility_files": [
    "clawgym_overlay/reference_driver.py",
    "clawgym_overlay/reference_driver_r1c.py",
    "clawgym_overlay/reference_driver_r1d.py",
    "clawgym_overlay/reference_driver_r1e.py",
    "clawgym_overlay/r1d_protocol.py",
    "clawgym_overlay/r1e_protocol.py",
    "clawgym_overlay/r0_panel_bridge.py",
    "clawgym_overlay/reference_profiles.py"
  ],
  "research_only_files": [],
  "critical_files": [
    "clawgym_overlay/worker.py",
    "clawgym_overlay/worker_admission.py",
    "clawgym_overlay/worker_profile.py",
    "clawgym_overlay/worker_runtime.py",
    "clawgym_overlay/reference_runner.py",
    "clawgym_overlay/qualification_runner.py",
    "clawgym_overlay/materialize_lock.py",
    "clawgym_overlay/runtime_image_backend.py",
    "clawgym_overlay/materialized_profile.py"
  ],
  "policy": {
    "active_line_min": 85.0,
    "active_branch_min": 80.0,
    "critical_line_min": 95.0,
    "critical_branch_min": 95.0,
    "frozen_requires_digest_and_golden_replay": true
  }
}
